[
  {
    "name": "artificer",
    "source": "Eberron - Forge of the Artificer",
    "hitDie": 8,
    "primaryAbility": "intelligence",
    "savingThrows": [
      "constitution",
      "intelligence"
    ],
    "skillProficiencies": [
      "Arcana",
      "History",
      "Investigation",
      "Medicine",
      "Nature",
      "Perception",
      "or Sleight of Hand"
    ],
    "weaponProficiencies": [
      "Simple weapons"
    ],
    "armorTraining": [
      "Light and Medium armor and Shields"
    ],
    "startingEquipment": "Choose A or B: (A) Studded Leather Armor, Dagger, Thieves’ Tools, Tinker’s Tools, Dungeoneer’s Pack, and 16 GP; or (B) 150 GP",
    "classFeatures": [
      {
        "level": 1,
        "name": "Spellcasting",
        "description": "You have learned how to channel magical energy through objects. See the Player’s Handbook for the rules on spellcasting. The information below details how you use those rules with Artificer spells, which appear in the Artificer Spell List.\nTools Required. You produce your Artificer spells through tools. You can use Thieves’ Tools, Tinker’s Tools, or another kind of Artisan’s Tools with which you have proficiency as a Spellcasting Focus, and you must have one of those focuses in hand when you cast an Artificer spell (meaning the spell has an M component when you cast it).\nCantrips. You know two Artificer cantrips of your choice. Acid Splash and Prestidigitation are recommended.\nWhenever you finish a Long Rest, you can replace one of your cantrips from this feature with another Artificer cantrip of your choice.\nWhen you reach Artificer levels 10 and 14, you learn another Artificer cantrip of your choice, as shown in the Cantrips column of the Artificer Features table.\nSpell Slots. The Artificer Features table shows how many spell slots you have to cast your level 1+ spells. You regain all expended slots when you finish a Long Rest.\nPrepared Spells of Level 1+. You prepare the list of level 1+ spells that are available for you to cast with this feature. To start, choose two level 1 Artificer spells. Cure Wounds and Grease are recommended.\nThe number of spells on your list increases as you gain Artificer levels, as shown in the Prepared Spells column of the Artificer Features table. Whenever that number increases, choose additional Artificer spells until the number of spells on your list matches the number on the table. The chosen spells must be of a level for which you have spell slots. For example, if you’re a level 5 Artificer, your list of prepared spells can include six Artificer spells of levels 1 and 2 in any combination.\nIf another Artificer feature gives you spells that you always have prepared, those don’t count against the number of spells you can prepare with this feature, but those spells otherwise count as Artificer spells for you.\nChanging Your Prepared Spells. Whenever you finish a Long Rest, you can change your list of prepared spells, replacing any of the spells there with other Artificer spells for which you have spell slots.\nSpellcasting Ability. Intelligence is your spellcasting ability for your Artificer spells."
      },
      {
        "level": 1,
        "name": "Tinker's Magic",
        "description": "You know the Mending cantrip.\nAs a Magic action while holding Tinker’s Tools, you can create one item in an unoccupied space within 5 feet of yourself, choosing the item from the following list:\nBall Bearings\nFlask\nPouch\nBasket\nGrappling Hook\nRope\nBedroll\nHunting Trap\nSack\nBell\nJug\nShovel\nBlanket\nLamp\nSpikes, Iron\nBlock and Tackle\nManacles\nString\nBottle, Glass\nNet\nTinderbox\nBucket\nOil\nTorch\nCaltrops\nPaper\nVial\nCandle\nParchment\nCrowbar\nPole\nSee the rules for the item in the Player’s Handbook. The item lasts until you finish a Long Rest, at which point it vanishes.\nYou can use this feature a number of times equal to your Intelligence modifier (minimum of once), and you regain all expended uses when you finish a Long Rest."
      },
      {
        "level": 2,
        "name": "Replicate Magic Item",
        "description": "You have learned arcane plans that you use to make magic items.\nPlans Known. When you gain this feature, choose four plans to learn from the Magic Item Plans (Artificer Level 2+) table. Bag of Holding, Cap of Water Breathing, Sending Stones, and Wand of the War Mage are recommended. Whenever you gain an Artificer level, you can replace one of the plans you know with a new plan for which you qualify.\nYou learn another plan of your choice when you reach certain Artificer levels, as shown in the Plans Known column of the Artificer Features table. When you choose a plan to learn, you choose it from any Magic Item Plans table for which you qualify; your qualification is based on your Artificer level.\nCreating an Item. When you finish a Long Rest, you can create one or two different magic items if you have Tinker’s Tools in hand. Each item is based on one of the plans you know for this feature.\nIf a created item requires Attunement, you can attune yourself to it the instant you create it. If you decide to attune to the item later, you must do so using the normal process for Attunement.\nWhen you reach certain Artificer levels specified in the Magic Items column of the Artificer Features table, the number of magic items you can create at the end of a Long Rest increases. Each item you create must be based on a different plan you know.\nYou can’t have more magic items from this feature than the number shown in the Magic Items column of the Artificer Features table for your level. If you try to exceed your maximum number of magic items for this feature, the oldest item vanishes, and then the new item appears.\nDuration. A magic item created by this feature functions as the normal magic item, except its magic isn’t permanent; when you die, the magic item vanishes after 1d4 days. If you replace a plan you know with a new plan, any magic item created with the replaced plan immediately vanishes.\nIf an item that you created with this feature is a container, such as a Bag of Holding, and it vanishes, its contents harmlessly appear in and around its space.\nSpellcasting Focus. You can use any Wand or Weapon created by this feature as a Spellcasting Focus in lieu of using a set of Artisan’s Tools.\nMagic Item Plans (Artificer Level 2+)\nMagic Item Plan\nAttunement\nAlchemy Jug\nNo\nBag of Holding\nNo\nCap of Water Breathing\nNo\nCommon magic item that isn’t a Potion, a Scroll, or cursed (you can learn this option multiple times and must select a different item each time; each item selected counts as a different plan)\nVaries\nGoggles of Night\nNo\nManifold Tool\nYes\nRepeating Shot\nYes\nReturning Weapon\nNo\nRope of Climbing\nNo\nSending Stones\nNo\nShield +1\nNo\nWand of Magic Detection\nNo\nWand of Secrets\nNo\nWand of the War Mage +1\nYes\nWeapon +1\nNo\nWraps of Unarmed Power +1\nNo\nMagic Item Plans (Artificer Level 6+)\nMagic Item Plan\nAttunement\nArmor +1\nNo\nBoots of Elvenkind\nNo\nBoots of the Winding Path\nYes\nCloak of Elvenkind\nYes\nCloak of the Manta Ray\nNo\nDazzling Weapon\nYes\nEyes of Charming\nYes\nEyes of Minute Seeing\nNo\nGloves of Thievery\nNo\nHelm of Awareness\nNo\nLantern of Revealing\nNo\nMind Sharpener\nYes\nNecklace of Adaption\nYes\nPipes of Haunting\nNo\nRepulsion Shield\nNo\nRing of Swimming\nNo\nRing of Water Walking\nNo\nSentinel Shield\nNo\nSpell-Refueling Ring\nYes\nWand of Magic Missiles\nNo\nWand of Web\nYes\nWeapon of Warning\nYes\nMagic Item Plans (Artificer Level 10+)\nMagic Item Plan\nAttunement\nArmor of Resistance\nYes\nDagger of Venom\nNo\nElven Chain\nNo\nRing of Feather Falling\nYes\nRing of Jumping\nYes\nRing of Mind Shielding\nYes\nShield +2\nNo\nUncommon Wondrous Item that isn’t cursed (you can learn this option multiple times and must select a different item each time; each item selected counts as a different plan)\nVaries\nWand of the War Mage +2\nYes\nWeapon +2\nNo\nWraps of Unarmed Power +2\nNo\nMagic Item Plans (Artificer Level 14+)\nMagic Item Plan\nAttunement\nArmor +2\nNo\nArrow-Catching Shield\nYes\nFlame Tongue\nYes\nRare Wondrous Item that isn’t cursed (you can learn this option multiple times and must select a different item each time; each item selected counts as a different plan)\nVaries\nRing of Free Action\nYes\nRing of Protection\nYes\nRing of the Ram\nYes"
      },
      {
        "level": 3,
        "name": "Artificer Subclass",
        "description": "You gain an Artificer subclass of your choice. A subclass is a specialization that grants you features at certain Artificer levels. For the rest of your career, you gain each of your subclass’s features that are of your Artificer level or lower.\nArtificer Subclasses\nName\nAlchemist\nArmorer\nArtillerist\nBattle Smith\nCartographer"
      },
      {
        "level": 4,
        "name": "Ability Score Improvement",
        "description": "You gain the Ability Score Improvement feat or another feat of your choice for which you qualify. You gain this feature again at Artificer levels 8, 12, and 16."
      },
      {
        "level": 6,
        "name": "Magic Item Tinker",